Questions,Answers
top vegetarian restaurants trichy? ,"Sri Gowri Krishnaa Restaurant-Location Thillai Nagar, Trichy 
Saivam Dimora North Indian Restaurants-Location W B Road, Tiruchirappalli East, Trichy 
Aswins Sweets & Snacks	50A, Sathanur Main Rd, Sundar Nagar, K K Nagar, Tiruchirappalli, Tamil Nadu 620021
Amma Unavagam	Salai Rd, Sakthi Mariamman Nagar, Woraiyur, Tiruchirappalli, Tamil Nadu 620003
Sri Ranga Tiffin Center	Sannathi St, Srirangam, Thiruvanaikoil, Tiruchirappalli, Tamil Nadu 620005
Varagoor sri venkatesa catering services	C 4 Ragavendra avenue, Raghavendrapuram, Tamil Nadu 620006
Sri annapoorani tiffen center	366, Big Bazaar St, Tharanallur, Tiruchirappalli, Tamil Nadu 620008
Sri Venkatesa Bhavan	SOUTH GATE, 75, Ammamandapam Rd, Srirangam, Tamil Nadu 620006
Hotel Arangan's vegeterian	AA 6/1 Housing unit Salai Road, Woraiyur Aiyshwariya Hospital Back Side, Tamil Nadu 620003
Govindhan Tiffin Kadai	24, Sannathi St, Srirangam, Thiruvanaikoil, Tiruchirappalli, Tamil Nadu 620005
Sri Santhi Bavan	5th Pragaram, Srirangam, Thiruvanaikoil, Tiruchirappalli, Tamil Nadu 620005
Sri Raghavendra Annapoorni Homely Mess	6, Raghavendra Puram Rd, near shri raghavendra swamy mutt, Sriramapuram, Tiruchirappalli, Tamil Nadu 620006"
top Non vegetarian restaurants trichy? ,"KMS Hakkim Kalyana Biriyani Restaurant	No-5, Shastri Rd, Near Passport Office, North East Extension, Thillai Nagar, Tiruchirappalli, Tamil Nadu 620017
IRCTC Cell Kitchen	Bharathiyar Salai, Sangillyandapuram, Tiruchirappalli, Tamil Nadu 620001
Arcot Naanavazhi Rowthar Briyani (Biryani Shop / Best Biriyani /Non Veg Hotel) in Trichy	No.86n Bank Colony, Ganesh Nagar, K K Nagar, Tiruchirappalli, Tamil Nadu 620021
Muniyandy Vilas Veg & Non Veg Hotel	Hanifa Colony, Sangillyandapuram, Tiruchirappalli, Tamil Nadu 620020
Birbal Biriyani Mandi ( Near LA cinemas)	Near LA Cinemas (Old Maris Theater, Fort Station Rd, Tiruchirappalli, Tamil Nadu 620002
Hotel Rajeswari	Thanjavur Rd, Ariyamangalam Area, Tiruchirappalli, Tamil Nadu 620010
Me (Meat And Eat )	295, Big Bazaar St, Near Gandhi Market Arch, Tiruchirappalli, Tamil Nadu 620008
Pattukkottai Kamatchi Mess - Chettinad Restaurant	Hotel Sevenna, 5, Royal Rd, Cantonment, Tiruchirappalli, Tamil Nadu 620001
Shri Sangeethas Veg. Restaurant	RPF6+WHV Service Road, No-10, Chennai - Trichy Hwy, near Sanjeevi Nagar
Shri Sangeethas	45, Karur Bypass Rd, opp. Kalaignar"
clothing-altering shops Locations in Trichy?,"Priya Ladies Tailoring & Training,Mel Valadi, Valadi, Tiruchirappalli, Tamil Nadu 621601
Vijay Tailors	Shop no. 18, Palakkarai Street, Woraiyur, Tiruchirappalli, Tamil Nadu 620003
Sri Ladies Tailor	Shop No, 32, Nelson Rd, Srirangam, Thiruvanaikoil, Tiruchirappalli, Tamil Nadu 620005
Nithyaa's Fashion Ladies Tailoring	Marudhanayagam Pillai Complex, L.I.C. Colony, near SBI Bank, Tiruchirappalli, Tamil Nadu 620021
Priya Ladies Tailoring	Kulumani Main Road, Kulumani, Tiruchirappalli, Tamil Nadu 620103
New Fashion Ladies Tailors	1/485, Vayalur Road, Somarasempettai, Tiruchirappalli, Tamil Nadu 620102
Lakshana Fashion Destination (ladies tailoring, bridal blouse designers in trichy, tailoring institute in trichy)	G3, Moorthy Square, West End Stop, Vayalur Rd, Puthur, Tiruchirappalli, Tamil Nadu 620017
S.R.M.Ladies & Gents Tailor	Allithurai, Tiruchirappalli, Tamil Nadu 620102
Shanthi Tailoring	Chennai Main Road, Tiruchirappalli, Tamil Nadu 621216
Dress Winner Tailors	7, Mandhai, Tennur Main Road, Thennur, Tiruchirappalli, Tamil Nadu 620017"
Children's hospitals in Tiruchirappalli?,"Child Health Clinic	8th Cross Rd E, Thillai Nagar East, West Thillai Nagar, Thillai Nagar, Tiruchirappalli, Tamil Nadu 620017
L.G. Well Baby Clinic	1st St, Sakthi Nagar, Pappakurichi Kattur, Tiruchirappalli, Tamil Nadu 620019
DR.S.VEERAMANICKAM CHILD CARE CLINIC AND VACCINATION CENTRE	4, DR. V.PARTHASARATHY, 47, 5th St, Cholan Nagar, Pappakurichi Kattur, Tiruchirappalli, Tamil Nadu 620019
Wonder Kids Clinic	Bus stop, Srinivasa Nagar, Vayalur Rd, near HDFC Bank, Tiruchirappalli, Tamil Nadu 620017
KSK Baby Clinic	Navaneethas Vela Apartment, U K T Malai, Vayalur Rd, Trichy~620102, Tamil Nadu 620102
Child Jesus Hospital	RM4P+2JR, Promenade Road, Opp TABS Complex
Vihas Hospital	Bishop Rd
Goverment Hospital Child Speciality Centre	RM6H+MHJ, Puthur High Rd
Akshaya Hospital	61, Sundarraj Nagar
Visalambal Hospital	RP74+FH3"
PLACES OF INTEREST FOR TOURISM in Trichy?,"1 ROCKFORT MONUMENT AND TEMPLE IN TIRUCHIRAPPALLI CITY Locations-Tiruchirapalli Rock Fort, NSB Rd, near Krishna Readymade hall, Singarathope, Devathanam, Tiruchirappalli, Tamil Nadu 620002
2 SRI RANGANATHA TEMPLE AT SRIRANGAM Location -Srirangam, Tiruchirappalli, Tamil Nadu 620006
3 SRI PUNDARIKAKSHA TEMPLE AT THIRUVELLARAI NEAR THURAIYUR location- Sannathi street, Agraharam, Thillampatti, Thiruvellarai, Tamil Nadu 621009
4 UTHAMAR KOIL AT PICHANDAR KOIL NEAR SR RANGAM Location-Manachanallur, Trichy - 621005
5 MUKKOMBU DAM (UPPER ANAICUT) Location-Mukkombu, Trichy
6 KALLANAI DAM (GRAND ANAICUT) Location -	Thanjavur district, Tamil Nadu, India
7 MARIAMMAN TEMPLE AT SAMAYAPURAM Location -Samayapuram, Trichy
8 MURUGAN TEMPLE AT VAYALUR IN TIRUCHIRAPPALLI Location-	Vayalur, Tiruchirapalli 
9 THIRUVANAIKOIL NEAR SRIRANGAM 
10 NACHIYARKOIL AT WORAIYUR IN TIRUCHIRAPPALLI 
11 ST. LOURDES CHURCH IN TIRUCHIRAPPALLI 
12 HAZRAT NATHAR SHAH DHARGA IN TIRUCHIRAPPALLI "
Boys and Mens dress or cloths shop in Trichy?,"Young N Style mens wear F1, Surya Complex, Near Holy Cross College, Singarathoppu Bus Stop, Madurai Road, Tiruchirappalli, Tamil Nadu 620008
Royal Mens Wear	34, Super Bazaar, Singarathope, Devathanam, Tiruchirappalli, Tamil Nadu 620008
PROFILES MENS WEAR	No:2 PRINCE BAZZAR GMAK BLOCK NSB LINK ROAD, behind MANGAL & MANGAL, Tiruchirappalli, Tamil Nadu 620002
BOB Men's Wear	No-10,11, Bellarmine Complex, College Rd, Tiruchirappalli, Tamil Nadu 620002
First look menswear	Sundar Nagar 4th Cross St, Sundar Nagar, K K Nagar, Tiruchirappalli, Tamil Nadu 620021
Aala Menswear	Door No. 45, Super Bazaar Corner, Annai Sivakami Complex, Singarathope, Tharanallur, Tiruchirappalli, Tamil Nadu 620008
Saran Mens Wear	42, Super Bazar Corner, Singarathope, Tiruchirappalli, Tamil Nadu 620008
Play 4 mens Garment	Ground Floor, Fathima Complex, No. 41 R, Near, Super Bazaar, Singarathope, Tiruchirappalli, Tamil Nadu 620008
Araa Outfits Mens Fashion wardrobe	8, 3rd Main Rd, Jaya Nagar Extension, IOB Nagar, Karumandapam, Tiruchirappalli, Tamil Nadu 620001
APT Menz Apparel	18, Nawab Walaja Complex, NSB Road, Tiruchirappalli, Tamil Nadu 620002"
Womens Dress Shops in Trichy?,"Keerthi�s women�s wear	58, 4th Cross Rd, Nehru Nagar, IOB Nagar, Karumandapam, Tiruchirappalli, Tamil Nadu 620001
Blossom Garments - Ladies Nighties & Innerwears	13 B, E Andar St, Devathanam, Tiruchirappalli, Tamil Nadu 620002
Women's World Ladies Tailors (?????? ???????)	Gandhi St, Subramaniyapuram, Sangillyandapuram, Tiruchirappalli, Tamil Nadu 620020
Dadra K Thulasiram	Ammamandapam Rd, Srirangam, Tiruchirappalli, Tamil Nadu 620006
Trend N New	519, Periya kadaiveethi, Singarathope, Devathanam, Tiruchirappalli, Tamil Nadu 620002
Flora Kollektions	Shop No. 4.1514, Reynolds Road, Cantonment, Tiruchirappalli, Tamil Nadu 620001
Vivaan Fashion Boutique	Shop No: A-9, #81, Adhavaa Commercial Complex, Ammamandapam Rd, Srirangam, Tiruchirappalli, Tamil Nadu 620006
A.R. Burka & Sarees	Alwarthoppu, Tiruchirappalli, Tamil Nadu 620017
My Wadrobe	Kaja Nagar, Edamalaipatti Pudur, Tamil Nadu 620023
Jay Laxmi Sarees	49,singar plaza complex, singarathope, near GVN Hospital, 620008"
Fun Activities & Games in Tiruchirappalli?,"
TipNTop Cue Sports,Barathidasan Salai Jeyam Fortune Square 2nd floor, Tiruchirappalli 620017 
Zapp Adventure Sports  location T.S No. 2627, A.I.B.E.A Nagar, Tiruchirappalli 620005 India
Bouncy House for  kids 123 Bharathiar Salai, Tiruchirappalli 620001 India"
Can you suggest a family-friendly game center or entertainment spot in Trichy?,Fun Land and ZAAP has a gaming zone suitable for families with a variety of games and activities.
Are there any local joints known for their unique burger shops in Trichy?,Check out Burger Junction near the Central Bus Stand for a variety of local twists on classic burgers.
"
Can you recommend a place in Trichy that serves authentic South Indian street food?","Head to Sree Annapoorna Sree Gowrishankar for a delightful experience of South Indian street food, including chaat items."
What are some local sweets or desserts unique to Trichy that I should try?,"Indulge in the famous Trichy Halwa, available at popular sweet shops like Adyar Ananda Bhavan and Shri Sangeetas.and special Jigarthanda at Famous Jigarthanda Stall."
Bike Show Rooms in Trichy?,"Krishnaa Bajaj @ Dindugal Road
Location
3, Dindugal road, Near Hotel Sangeethas, Central bus - stand , Trichy, Tiruchirappalli, Tamil nadu, 620001,
Vaibav Bajaj @ Thanjavur
Location
Old Chennai Trunk Road, Tiruchirappalli, Tamil nadu, 621703
,S S Yamaha
Location
No. 30 (M1-3, C1, 2, 6, 7) Royal City, Karur Bye Pass Road, Teppakulam Post, Trichy Tiruchirappalli, Tamil nadu, 620002,Jai Shakti Bajaj @ Tiruvanaikoil
Location
1352/1352A, Vijay Towers, Tricny Main RoadThuraiyur, Tiruchirappalli, Tamil nadu, 621008
,Vaibav Bajaj @ Mannargudi
Location
Thanjavur Bye Pass Road, Vin Nagar, Kattur (Near Chithra Nagar)Thiruverumbur, Tiruchirappalli, Tamil nadu, 620019,KTM@DINDIGUL
Location
SRI PADMESHRAM COMPLEX, PERIYAKULAM ROAM, P.K PATTI, ALLINGARAM, THENI, Tiruchirappalli, Tamil nadu, 621302,VELA AUTOMOBILE PRIVATE LIMITED
Location
20, C113, 5th Cross Rd E, Thillai Nagar East, West Thillai Nagar, , Tiruchirappalli, Tamil nadu, 620018"
Can you recommend a shop in Trichy that offers both bike spare parts and car accessories?,"Wheels and Gears"""" on East Boulevard Road is a one-stop-shop for bike spare parts and a variety of car accessories."
What is the name of the ancient dam located on the Kaveri River near,"""The ancient dam located on the Kaveri River near Trichy is commonly known as """"Kallanai Dam"""
Bakery and Cake Shops in Tiruchirappalli?,"CK's BAKERY , Cantonment, TABS Complex, Opposite American Hospital, Williams Road, Bharathidasan SalaiTABS Complex, 41, Williams Rd, Cantonment, Tiruchirappalli, Tamil Nadu 620001
Aswins Sweets & Snacks	3/11, Gandhi Road Sriramapuram, Srirangam, Tamil Nadu 620006
CakeBee	3a, Bharathidasan Salai, campion school Cantonment, Cantonment, Tiruchirappalli, Tamil Nadu 620001
CakeBee	Plot No 7, Singaram Nagar Ellakudi Post, Thanjavur Rd, near Montfort School, Tiruchirappalli, Tamil Nadu 620019
CakeBee	Ground Floor, Sanjay Flats Near Bishop Heber College, Vayalur Rd, Puthur, Tiruchirappalli, Tamil Nadu 620017
Sri Balaji Bakery	Thiruvalluvar Nagar, Vivek Nagar, Pappakurichi Kattur, Tiruchirappalli, Tamil Nadu 620010
???????????	Tamil Nadu 639115
Dobbelstein Bakers & Pizzas	No. 5, 8, Bharathidasan Salai, Melapudur, Cantonment, Tiruchirappalli, Tamil Nadu 620001
ARS Bakery	MGR Nagar, Ramachandra Nagar, Bharathi Nagar, Tiruchirappalli, Tamil Nadu 620012
Best Iyyagars Bakery	be colony bustop, Tamil Nadu"
Cineama or Theaters in Trichy?,"Anbu Cinema,National Highway 227,Akilandeshwari Nagar, Tiruchirappalli,Trichy

Cauvery Theatre,Palakarai,Trichy,Kalaiarangam,Near Central Bus Stand,Trichy

Maharani Theatre,E.B Road,Trichy

Maris Complex,Victoria Road, Near Teppakulam Bus Stop, Annamalai Nagar,Tiruchirappa,Trichy"
stay Hotels in Tiruchirappalli?,"Hotel Shri Swarna's Palace	75, B/2, Salai Rd, North East Extension, Tennur, Tiruchirappalli, Tamil Nadu 620018
OYO 7021 High Point Serviced Apartment	Vaas Nagar, Manghalam Vaidya, Chennai Bypass Rd, Mahalakshmi Nagar, Tiruchirappalli, Tamil Nadu 620010
OYO 79306 Sri Sai Homestay	No-2/29 Ganesh Nagar 3rd Street Opp Ganesh Complex Post, K K Nagar, Tiruchirappalli, Tamil Nadu 620021
OYO 18621 V Grand	Bus Stand, 13C Alam Towers Royal Road opp Central, Cantonment, Tiruchirappalli, Tamil Nadu 620001
Welcome Hotel	Mudaliyar Chathiram, Bells Railway Colony, Sangillyandapuram, Tiruchirappalli, Tamil Nadu 620001
OYO 13212 Hotel Sampath	Chinthamani, Chathiram, Bus stand, 46C, Karur Bypass Rd, Melachinthamani, Tiruchirappalli, Tamil Nadu 620002
Nandu Bhattar Swamy Guesthouse	Sriramapuram, Tiruchirappalli, Tamil Nadu 620006
MAHALAKSHMI RESIDENCY	No-42-B Singarathope, Road, Tiruchirappalli, Tamil Nadu 620008
OYO 60111 M.s.residency	52 Moola Thoppu, Melur Rd, Sriramapuram, Tamil Nadu 620006"
Trichy Arts and Sciences college?,"KURINJI COLLEGE OF ARTS AND SCIENCE - RPF4+W6F, EB Rd, Devathanam, Tiruchirappalli, Tamil Nadu 620002
Srimad Andavan Arts And Science College - Nelson Rd, Srirangam, Thiruvanaikoil, Tiruchirappalli, Tamil Nadu 620005
Aiman College of Arts & Science For Women - Near KK Nagar K, Sathanur, Tiruchirappalli, Tamil Nadu 620021
KSR college of Art and science - Hanifa Colony, Sangillyandapuram, Tiruchirappalli, Tamil Nadu 620020
SRM Arts and Science College, Trichy - Irungalur, Tamil Nadu 621105
Kalai Kaviri College of Fine Arts - 18, Benwells Rd, Cantonment, Tiruchirappalli, Tamil Nadu 620001
Urmu Dhanalakshmi Arts College - Venugopal Nagar, Pappakurichi Kattur, Tiruchirappalli, Tamil Nadu 620019
St. Joseph's College (Autonomous) - Annamalai Nagar, Woraiyur, Tiruchirappalli, Tamil Nadu 620002
M.I.E.T Arts & Science College - MIET Arts & Science College, Pathway, Gundur, Tamil Nadu 622515
Government Arts College - Kamarajapuram BHEL Township, Tiruchirappalli, Tamil Nadu 620022
Periyar E.V.R. College -  36/2, Race Course Road, Kajamalai Colony, Tiruchirappalli, Tamil Nadu 620023
Shrimati Indira Gandhi College - bus stand, No: 369 College Road, Near Chatram, Theppakulam, Tamil Nadu 620002
Holy Cross College - back side of Chennai silks, Madurai Rd, Tharanallur, Theppakulam, Tiruchirappalli, Tamil Nadu 620002
Sri Madhi Indra Ganesan College -  Singarathope, Tharanallur, Tiruchirappalli, Tamil Nadu 620002
Jamal Mohamed College -  7, Race Course Road, Kaja Nagar, Tiruchirappalli, Tamil Nadu 620020
National College - Trichy-Dindigul Rd, opp. LIC Office, Jaya Nagar Extension, IOB Nagar, Karumandapam, Tiruchirappalli, Tamil Nadu 620001
Bishop Heber College -  Vayalur main Road, nal Road, near Puthur, Tiruchirappalli, Tamil Nadu 620017"
Top Best colleges for womens?,"""Holy Cross College for Women:Empowering Women through Education and Excellence.
Bishop Heber College for Women:Nurturing Minds, Inspiring Futures for Women's Success.
National College for Women: Shaping Leaders, Building Futures - Where Women Excel.
Seethalakshmi Ramasamy College for Women: Transforming Dreams into Achievements, One Woman at a Time.
Bharathidasan University - Women's Studies Centre: Fostering Knowledge and Equality - Empowering Women Through Education.""
Top College ,""National Institute of Technology (NIT) : Pinnacle of Academic Excellence in Trichy.
Bharathidasan Institute of Technology (BIT):Shaping Futures, Empowering Minds in Trichy.
St. Joseph's College (Autonomous): Nurturing Excellence, Inspiring Leadership in Trichy.
Jamal Mohamed College: Fostering Knowledge and Character in Trichy."""
Kalayana Mahal(Marriage Hall) or engagement hall in trichy.,"Kundalam Sri Ranga Mahal - KSR Mahal Marriage Hall Srirangam	132, N Chithirai St, Srirangam, Tiruchirappalli, Tamil Nadu 620006
APS Marriage Hall	NH-227, Mahalakshmi Nagar, Thalakkudi, Tiruchirappalli, Tamil Nadu 621216
RAASI HALL A/C	Dravida Munnettra Kazhagam Party Office, Nagappattinam Trichy Karur Coimbatore Mettupalayam Ooty Gundlupet Rd, V N Nagar, Annamalai Nagar, Woraiyur, Tiruchirappalli, Tamil Nadu 620002
JJ Funtion Hall	222, Sangliandapuram Main Rd, Sangliandapuram, Sangaliandalpuram, Tiruchirappalli, Tamil Nadu 620001
Subha Mangala Hall A/C	104, Salai Rd, Sakthi Mariamman Nagar, Thillai Nagar, Tiruchirappalli, Tamil Nadu 620003
Jubilee Kalayana Mandabam	Venugopal Nagar, Pappakurichi Kattur, Tiruchirappalli, Tamil Nadu 620019
Shara Arts Sangamam & Mini Hall	Warner Gem Complex, Warners Road,, Cantonment, near Palli Vasal, Tiruchirappalli, Tamil Nadu 620001
Shrivaaru Mahal	Kumbakonathar Salai, Srirangam, Thiruvanaikoil, Tiruchirappalli, Tamil Nadu 620005
MSK mini hall	Anna Nagar Rd, Anna Nagar, Thillai Nagar, Tiruchirappalli, Tamil Nadu 620026
Sakthi Mahal Kalyanamandapam	Nagapattinam - Coimbatore - Gundlupet Hwy, Cholan Nagar, Pappakurichi Kattur, Tiruchirappalli, Tamil Nadu 620019
"
